movie,winner,top_critics
Onward ,0,"Theres a lot to like in Onward, the least of which is its bright, appealing animation, character design and world building, but you wouldnt expect anything less from an outfit as accomplished as Pixar., A very sweet story, good but not great...kids will love it., The second half pulled it together. By the end of it, I was like, well done., Onward feels a bit more subdued than a typical Pixar affair, and while the movie wears its heart on its sleeve, it might not be quite as engaging for younger viewers., Do families need fathers? Scanlon delivers a love song to atypical clans, which couldnt end on a sweeter, or clearer, note., The fractious bond between the brothers and their aching anger at the loss of a parent are evoked with exquisite sorrow and clarity., Scanlons film is an improvement on his previous directorial effort, the pointless prequel Monsters University. But Onward falls well short of magical., Even mid-level Pixar still casts a spell., While it isnt as emotionally involving as some other Pixar films, there is sufficient artistry and joyful storytelling here, There\s something here for everyone, even if the overall package isn\t likely to go down as the next Disney/Pixar classic., Onwardmanages to find a balance between comedy and adventure that\s eminently satisfying. The magic ingredient that drives this movie is sincerity., Onward feels frantically eager to please, until it tries to yank at your heartstrings in the by-now familiar formula of Pixar Animation., The adventure and world building in Onward are utterly delightful with an especially effective balance of playfulness and depth., A likable family comedy that finds an easy rhythm without effort., Its a pretty gosh darn imaginative place, and its a safe bet kids of all shapes and sizes will look at it all in wide-eyed glee., A testament to the remarkable degree of emotional expressiveness that Pixars character-animators can imbue into a story., Only a true cynic could wholly resist Onwards deeper themes, but they come in the service of a movie that has to be classified in the mid-level tier of the Pixar file., Its enjoyable enough if you dont mind machine-made entertainment, but so desperate to please that it wears out its welcome long before the closing credits., As a Pixar entry, it may be the first to explicitly grapple with not the trials of childhood, but the fraught onset of adulthood. By the time Onward has wrapped its journey, it will probably be the only movie with a manticore to make you cry., It may not be as revolutionary as some of Pixars past offerings - and in that sense, it offers a glimpse of the studios likely future - but it still retains a spark of that old-time magic."
The SpongeBob Movie: Sponge on the Run,0,"Unfortunately, the film didnt feel like it really had a story. It felt like a series of sketches, and most of them werent very funny., Though not as joltingly outrageous as its predecessors, The SpongeBob Movie: Sponge On The Run is a winsomely wacky good time, alive with laughs and light-hearted lunacy., There\s nothing stiff or self-serious about Sponge on the Run, which plays equally to young children and college stoners alike., Sweet, silly, with that profoundly bizarre world view that makes a snail trail gag open to everyone for a laugh, this may not change SpongeBob forever, but its more SpongeBob as we love him, and thats all the fun you can need., Watching one of these movies is like having a vision of Cthulhu; you walk away from the experience a changed person, possibly raving about the apocalypse., The movie is an act of loony generosity we shouldnt refuse. This is ludicrous entertainment for frazzled times., Resistance is futile. SpongeBob is going to win you over. So settle back to enjoy the ebullient silliness, sweet friendship, origin story, very surprising guest stars., The pacing lags, the goofiness sags, and you discover over time that theres not much holding these antics together., Sponge on the Run may take us back under the sea, but this sponge is all dried up., Its mindless fun, just what the doctor ordered., This trip is filled with goofy fun, though it wanders enough to occasionally test the attention spans of those neither young enough nor high enough to be in the films target audience., But I will say that SpongeBob is what we need all the time. The more the merrier., Sponge on the Run milks the actor\s brand for a number of solid laughs), and the animation is detailed and inventive enough for the whole film to feel drenched in SpongeBob\s demented energy., Sponge on the Run is very much a members-only affair. Then again, three movies and several hundred TV episodes into a 22-year-old franchise, it\s not unreasonable to think the audience for this adventure is pretty well baked into the cake., The intentions of Sponge On The Runs writer-director, Tim Hill... might be noble. But the result mostly serves as a reminder that SpongeBob SquarePants, despite all the fun, is a lucrative modern media franchise like any other., In an era when so many eight-minute animated shorts have been bloated beyond proportion when becoming 90-minute movies, Team SpongeBob deserves credit for building out a storyline without losing sight of what made the original beloved in the first place., If the SpongeBob franchise has finally gone on the run, it seems like its left the audience that matters most in the dust., Its a simple plot, but the movie vaults over the humdrum wheel-spinning quality that has come to define too much studio animation., Fast, funny, demented., I\m so confused, said my 10-year-old, reacting to the movie\s strange distractions and delights while barely hanging onto the throwaway plot."
Freaky ,0,"Keyed into its worldview and has fun with it in clever ways. It walks the line so so delicately, I was happily taken aback by this one., The film has its moments, but a camp Vince Vaughn is a device of diminishing returns., Freaky zips by amusingly enough, but its concepts never quite pop like they did in Happy Death Day, nor does it push the envelope enough for a film that references the dark masterpiece that is Heathers so early on., Freaky isnt half as odd as it could be, and its less satisfying as a result., When its in the mood, horror can be a sexually subversive genre; it can also be a flagrantly non-PC one. Freaky treads a treacherous line between the two with aplomb., While not quite on a par with Happy Death Day, Freaky is an ebullient slasher that strikes a perfect balance of comedy and carnage., Freaky knows its a farce and winks at the silliest of slasher tropes, but that satirical edge doesnt keep it from being one of the most purely enjoyable horror works Ive seen in a long time., You can feel the humor and the terror continually goosing each other here instead of canceling each other, even in the bits that dont quite work or feel like padding., Freaky isnt just the future of inclusive, social justice horror either. Freaky is the future of the horror genre altogether., A freak flag half-flown., Simply put, Freaky sucks., Things lag in the flabby midsection and a tacked-on double ending would have been better left on the cutting room floor, but Freaky has enough going for it - namely Vaughn, who\s better than he\s been able to be in years - that it\s worth a stab., Its fun to watch Kathryn Newton and Vince Vaughn play each other, but I think it runs out of steam as it goes on., Vince Vaughn is convincing as both a serial killer and the teen who inhabits his person in the self-aware horror comedy., Freaky is amusing and gory enough to still be an entertaining slasher movie with its own satisfying spin on the final-girl trope., Not every joke or jolt hits the mark. But thanks to a go-for-broke Vince Vaughn as a serial killer who body swaps with a teen girl, you wont find d a better way to laugh out loud while being scared senseless than with this Freaky Friday the 13th., Blumhouse has an uncanny ability to identify projects that sound compelling on paper but are less attractive when watched on-screen. Freaky is the latest of these., In between all of the murders and mayhem, there is room for some sly humor and some genuine warmth. Vaughn and Newton have a blast and it is a lot of fun., We can\t argue Freaky takes the genre to the next level, exactly - but it\s still bloody good fun., No one is doing comedy-horror better. As with the Happy Death Day films, Freaky hilariously modernizes the high school bloodbath for laughs."
Tenet ,0,"Nolan prioritizes the dense audiovisual spectacle of his most narratively complex films. Beyond the intellectual, they exist primarily, and more accessibly, as experiences. Put another way: Tenet is a vibe., As a delivery system for the thrills, I think the film gets a long way, and you can kind of sit back and enjoy it. As a delivery system for the ideas, I think it trips itself up an awful lot., Something like the epitome of Nolans temporally twisty canon, distilling his many cinematic signatures and preoccupations down to their entrancing abstract essence., Christopher Nolan is very clever, but mostly irritating is what I find. His movies are not cerebral - theyre fake cerebral... He doesnt even do the time travel right., I am a big fan of Christopher Nolans films -- I usually enjoy the time puzzle of it -- but this seems even more intentionally inaccessible and challenging than everything else... Confusing, distancing, and chilly., Tenet is indeed impressive, although I gave up trying to follow the plot., Tenet is difficult to understand, but even worse, it inspires little desire to understand it., The auteur doesnt show much growth in his most recent self-indulgent work., It is easy to sit back and revel in the wonder of the big-screen experience, and to immediately want to see the film again. And again., For a writer often accused of being humorless, this may be his most playful script, often arid in its dry humor, and much of it provided by Pattinson playing an inverted Felix Leiter to Washingtons stoical Bond riff., Tenet is what happens when Nolan forgets Bordens wisdom from The Prestige. Hes so obsessed with how impressive his secret is that the trick he uses it for is nothing., What strikes you is how determinedly bare of feeling it seems, even when emotional opportunities present themselves., Telling a story backward sounds bizarre - it is bizarre - but it works. The backward stuff in Tenet sounds bizarre - worse than bizarre, goofy - and for a while it works. But once it doesn\t, it really doesn\t., Its the first Nolan movie in a long while that Ive left feeling disappointed. And yet there is enough good stuff buried beneath its antiseptic, perhaps overly showy technique, once you get past the clankier bits, that is worth exploring., Its a shiny clockwork contraption with a hollow center: a convoluted Rubiks Cube blockbuster that, once solved, reveals little more than the complexity of its own design., John David Washington has crossed a bridge. Hes no longer just the son of a superstar actor. He is a superstar actor., Both utterly dazzling and increasingly bewildering., Maybe you could follow what is happening if you wrote it all down on a flow chart with circles and arrows and multiple colored inks, but it wouldnt be worth the effort - and thats hard to do in a dark movie theater., These amazing set pieces, while respectable for their reliance on practical effects and impressive for Nolans commitment to his craft, often feel divorced from the rest of Tenet., Nolan has finally zoomed out so far with a story that fundamentals of physics have themselves become character motivations."
The United States vs. Billie Holiday,0,"Andra Day outclasses and saves an otherwise humdrum movie., Andra Day is spellbindingly good as the jazz legend whose anti-racist song Strange Fruit made her an enemy of the racist U.S. government, but the film built around her isn\t worthy., Day is simply dazzling in the role, and more than makes up for some of the films other shortcomings, which include the rather ponderous direction., Lee Daniels new movie is the first clear-eyed look at her life that weve seen on screen. And this time, theres plenty of grit with the glamour., Lady Day\s pain and incomparable talent feel authentic, thanks solely to Andra Day. Everything around her feels so shamefully inauthentic that it dishonors both., Andra Day is amazing, and she is far and away the best part of this movie., It all hangs on Andra Days performance. Shes fantastic in this movie., I think overall there were some moving moments, but the execution kind of left something to be desired... I always judge a film by whether or not Id watch again - and for me? Once was enough., It feels like Im watching trauma porn with one hell of a soundtrack., The biggest flaw of The United States vs. Billie Holiday, besides its commitment to substituting shocking violence for character development, is that it cannot decide how its leading lady sees herself., Its a film that punishes its main character and, rather than watching her live (forget celebrating her life in its wholeness), waits - perhaps almost hopes - for her to finally die, having finally endured too much., The United States vs. Billie Holiday isn\t quite worthy of the performance at its core., The central performance is brilliant. Stylistically, its very all over the place and it swerves between hallucinogenic sequences and bodacious music...that muddies the whole...worth seeing for the performance., There is a story about Billie Holiday that we really need to see...but this is not it. I struggle with this, because I love Lee Daniels..., Maybe each era invents the Lady Day that suits it. Lee Danielss new drama, The United States vs. Billie Holiday, sweeps in as a valiant corrective, starring the singer Andra Day as a complicated, impulsive, vibrant person..., Billie Holiday -- Andra Day\s impressive and unexpected lo-fi approach to the role notwithstanding -- is missing. Billie Holiday, a brutally thin sketch of the woman, is all the movie is prepared to give us., The more you know about legendary singer Billie Holiday the more trouble youre likely to have digesting Lee Danielss punishing new biopic. The film fails to express how much music meant to her-or what an impact she made on audiences & fellow musicians, Respect the ambition, but just doesnt quite land., This is Days show all the way, and her performance remains the films strongest suit., Billie Holidays life was filled with so much tragedy and triumph that it must count as some sort of accomplishment to make a boring movie about her."
Shang-Chi and the Legend of the Ten Rings,0,"For fans of cinematic spectacle, Shang-Chi and the Legend of the Ten Rings offers some of the best choreographed action sequences of the Marvel Cinematic Universe., The first half of the film is better, and I liked it much more than I was expecting., Its a strong debut for a new hero, injecting diverse blood into the MCU in a way that does not feel forced or hollow. I just think the overall film is still less than the sum of its more outstanding parts., Shang-Chi and the Legend of the Ten Rings at least continues the studios track record of enlisting the talents of truly great artists. Here, that would be the commanding and charismatic Leung., Great action, Simu Liu is a great kind of charismatic center for the film., The picture rattles along with an unpretentious vigour too rare in the Marvel universe., Its a good movie. Its got a plausibly fearsome villain by way of Leung, a nice ensemble of heroic personalities, and a dose of actually-poignant family drama undergirding all the rest., A metatextual antithesis to the racism and whitewashing in Marvels own history, and a cinematic celebration of the Chinese diaspora on and off screen., Its vanishingly rare for a film to actually deserve its hype. But Shang-Chi and the Legend of the Ten Rings does so, and more., Shang Chi And The Legend Of The Ten Rings is a strong step forward for the MCU., Almost any movie ascending out of the Marvel Cinematic Universe at this point requires a classicists devotion to subtextual minutiae. Which is exactly why Shang-Chi and the Legend of the Ten Rings is such a breath of freshly fantastical air., So what if the showoff climax subs depth for dazzle. As the first Asian hero in Marvel history, former stuntman Simu Liu is action poetry in motion and his epic starring debut kicks off the fall film season on a rousing high note., Shang-Chi and Katy are my new best friends., Shang-Chi doesnt just pull off a fun western xuanhuan, but makes it feel like a door being opened for future Marvel films., Yes, Shang-Chi and the Legend of the Ten Rings is culturally significant, but this should not be lost: It\s also a fantastic movie., Its fresh, its alive, its not the same old Marvel Cinematic Universe. There are also awesome dragons., Shang-Chi holds his own, but he doesn\t leave you wanting more. It feels like a one-and-done while we get back to the main attraction., As the MCU emerges from the long shadow of the Infinity Saga, the newest members of the ever-growing ensemble make a compelling case for belonging among the candidates for the next iteration of The Avengers., A refreshing romp through - and loving homage to - martial arts cinema., Directed by Destin Daniel Cretton, the film is somewhat overstuffed and lumpy in parts and the last surreal third is poorly knitted into the rest of the narrative, but its all impossible to predict and youll leave the theater satisfied."
The Many Saints of Newark,0,"Alessandro Nivola is brilliant as Tony’s uncle, Dickie Moltisanti, an unstable explosive who didn’t feature in The Sopranos but whose story provides fascinating insights into characters such as Tony’s mother, Lydia (Vera Farmiga). Expect laughs too., No doubt devotees of the series will have different opinions as to the value of this backstory, but seen in isolation, as an intense and sometimes violent story of a dysfunctional family, the film is richly rewarding in its own right., Newcomers to the Soprano saga will have no difficulty tuning in. The narrative soon begins to take on the classic lines of authentic tragedy., The movie was, to borrow an image from the Pine Barrens episode, like sucking ketchup packets., I walked out of the theatre wishing for a limited TV series rather than a movie. Although The Many Saints of Newark offers an alluring glimpse into Tony Sopranos birth under a bad sign, it never shows the blue moon in the mobsters eyes., All of this is done well enough (although the late 60s and early 70s costuming feels a bit exaggerated, too on the nose) but its certainly not enough to elevate this film to the level of The Sopranos., As becomes almost immediately clear, there was no real reason for the movie to have been made, no inspiration for it that was not commercial., As a Goodfellas-ish crime drama that vividly evokes time and place, Saints is rendered with enough bare-knuckled verve, unpredictability, and darkly glinting wit to make it work., This is something the fans of the Sopranos have been wanting, and as a fan myself of the series, I found it fascinating to see Gandolfinis son playing with subtle distinctions as an interesting performer..., Even a seasoned Sopranos viewer will never feel completely sure of where the story is going., I like a lot about it, but it also feels like David Chase is trying to get an entire season of television into this two hour film., Its a polished, entertaining film, but a lot of its meaning derives from how much the audience cares about a handful of TV characters they may or may not already know., Heaven for Sopranos fans, though this is really less a prequel than a spin-off., Its a very smart piece of work that, oddly, owes as much to the films of Martin Scorsese as to the world Chase built over six appalling, satisfying seasons., Reduces characters of potentially mythic power to a handful of defining traits and pins them to a diorama-like backdrop of historical readymades., Even the pleasurable sight of Michael Gandolfini as young Tony was never going to make up for the complete absence, in this film, of anything remotely reflective of the tone and color of The Sopranos., Go ahead, arrange a sitdown: This darkly funny and ultra-violent film perfectly depicts the 1960s times and voices that shaped Tony into a made man., The magnetic Nivolas Uncle Dickie pulls the movies focus and overwhelms the coming-of-age saga that brought the gang -- and its many fans -- together in the first place., Making bigger than life gangster feature films is an art that should be left to the pros (Scorsese, Coppola). Stepping out of its cable TV lane hasnt helped The Many Saints of Newark., The creeping darkness of Many Saints of Newark has an effective build, an unnerving, pathetic portrait of past rot that would really only shift in clothing choices and locations to become the present tense of The Sopranos."
Wish Dragon,0,"I feel so indifferent about this whole thing... I forgot it as soon as I saw it., Wish Dragon delivers a whole new world, a new fantastic point of view, and that\s plenty., Wish Dragon is a transporting experience, but it\s far from a whole new world., Though Din\s relationship with Long never reaches the level of pathos Disney conjured with Aladdin and the Genie, Wish Dragon manages to offer a different riff on the classic be true to yourself narrative."
Crisis ,0,"Jarecki doesnt pretend to offer solutions, but his film does reveal how lost we can all get in the mix., I enjoyed Crisis. The performances are first rate and the tension builds throughout to a climax and then an aftermath., Its a union of crime and politics of the kind that you might expect to find on one of the streaming services, but its given extra heft by its broad canvas and ambitious segues., For all of its good intentions, the generic Crisis isnt showing us anything new., Those who have died or spent years tackling the opioid crisis deserve better than this., The films narrative and characters reason that any difficult situation can be solved with blind brute force and a pistol. If youre looking for a cutting critique of the American addiction industry, look elsewhere., Its a little too all over the place, with a few too many movies trying to be contained in this to be able to come together and make sense., It\s a noble effort, but like plans for a quick trip across the river to Montreal, Crisis never comes together., Its not enough merely to tell stories about different aspects of how drugs impact society - the connections have to be stronger and the narratives have to go deeper that what Jarecki has provided here., Its biggest crisis is that its a thriller with no thrills., The film juggles three main stories and more minor ones, and several end up going over the top..., Crisis feels like a lecture made up entirely of hypotheticals., The tragedy associated with such stories could provide fertile territory, theoretically, for a good drama about what went wrong and whos ultimately responsible. That movie might get made someday, but Crisis isnt it., A classic example of a movie that wants to be a little bit of everything, only to add up to a much lesser version of something you keep waiting to see., Nicholas Jarecki who wrote, directed, produced, and also appears in a supporting role, does none of these things well. Especially all of them.... Crisis is meant to be hard-hitting, but it is completely soft-headed., The issues - from addiction itself to the flawed incentives at institutions that might prevent it - demand a more expansive treatment., Filmmaker Nicholas Jarecki deploys a multi-narrative structure, a la Steven Soderbergh\s Traffic, for his well-intended epic on the American opioid epidemic. It doesn\t work., It feels like research dressed as a drama., Crisis is something of a horror film, and not in a good way., Well-meaning but underwhelming."
Playing God ,0,"What doesnt work on a logic level makes sense according to the characters and performances. And the twists - a con movie always has twists - are quite satisfying, even if you see them coming., Playing God is this weeks episode of Good Actors, Less Than Ideal Script."
