movie,winner,top_critics
Arkansas ,0,"The dialogue is hard-boiled and the cast includes reliable tough talkers: John Malkovich, Vince Vaughn and Michael K Williams., Feeling like a relic from the wave of 90s crime ensembles that followed in Tarantinos wake, Arkansas not only squanders some good talent, its a tragic waste of a fine book., As a collection of smart-mouthed southern neer-do-wells, Arkansas amuses, but as a showcase for colourful 70s menswear, it excels., With its brooding tone of tired inevitability, his Arkansas knows exactly how to find drama and sentiment in what could otherwise just be a dour path to the inevitable., Its quirky, lively, and diverting for a little while, but then it really just drags., Clark Duke shows some promise as a director and maybe even more so as a screenwriter, but it goes on too long, it is unevenly paced, and it seems to end a few times., Somehow it does have a sort of distinctive tang... It doesnt quite add up to a full meal despite being overlong, but it has a kind of ambling, affectionate weirdness to it., Less a mob thriller than a ruminative drama about a life built around orders and betrayals, the movie takes an unusual perspective on a familiar genre but is weighed down by its dull, uneven pace., Most of all it is unexpectedly fun, drawing you through its world of not-very-good-at-this criminals, low-lifes and people who want little more than to just hang about with verve and panache. And that makes it a place worth visiting., While Arkansas is a promising and often very entertaining first feature, Duke doesnt combine these borrowed ingredients-excellent though they are-into a fully realized original story, with its own personality., No matter the size of the screen or the corniness of dialogue, Arkansas proves that strong acting from game performers can make even the most harebrained of endeavors brim with vitality and necessity., If narrative drive is your thing, steer clear of Clark Dukes trifling whatzit about drug-dealing deadbeats, but pandemic-weary audiences might just revel in a southern-fried, comic randomness that becomes the films saving grace., Not everything here works, including some lead casting. But this daylight noir should please viewers willing to roll along with a crime meller more interested in character quirks than action thrills., Arkansas doesnt usually look like much (lots of music video lighting), and is often over-edited., The films insistence on keeping the stakes low throughout is probably its key strength., Arkansas doesn\t break the mold on cheeky, stylish, low-life movies; rather, it worships it., While it\s hard to watch Arkansas and not see its debt to the Coen brothers, Duke finds a voice of his own in quiet, deadpan absurdities and southern-fried eccentricities., Underwhelming, despite a surprising abundance of talent., Most of Arkansas... just falls flat, despite individual scenes here and there that work."
Coffee & Kareem,0,"The brand of humour relies on shock value, but every now and then it will hit you with something clever that comes along like a slice of pizza in the middle of a low carb diet., A profoundly irritating, cacophonous mess., Things quickly escalate into chaos and stay there, but they do so in ways that are not quite funny enough to make you forget the implausibilities or the way serious stuff is played for bad jokes., Its uneven start isnt enough to make it a total miss., Its pungently offensive and bracingly violent, but this Detroit-set action comedy is also blessed with a sharp script by Shane Mack and a weirdly likeable central pair., Coffee & Kareem is messy, but its an interesting sort of gross chaos., Coffee & Kareem is DOA., Ones a cop who cant shoot straight! Ones a kid with a nose for trouble! Together... they lack the wit, thrills and rapport to deliver fun genre times., There just isnt much of a movie here, or even much of an homage movie when you compare it to its clear influences like 48 Hours and Lethal Weapon., Theres a better movie buried underneath the many corpses in the crude and confused Netflix comedy Coffee & Kareem, one of their algorithmically assembled weekend options patchworked together from a stack of search terms., Everything goes stupefyingly wrong in this crime against comedy that features Ed Helms and Taraji P. Henson straining so hard for laughs that never come that you think director Michael Dowse was holding a gun to their heads., The biggest problem with Coffee & Kareem is no one is likable, least of all Gardenhigh\s character, whose tough-talking, off-putting exterior isn\t masking any inner insecurities. The kid\s just a jerk., Coffee & Kareem has a sweet premise at its core, with the two polar opposites tied together on a crazy quest, but its gets bogged down in its mission to shock and appall., Do the people who made Coffee & Kareem think that its a refreshing throwback? How can they not know that these kinds of movies happen all the time, and sometimes even make sense?, Coffee and Kareem is stuck in decaf mode., Although its lame-pun title is a tip-off, it still won\t prepare you for the 88 irretrievable minutes of your life that is the barrel-bottom action-comedy Coffee & Kareem., Theres politically incorrect, and then theres just plain wrong., Making a film that feels two days long is not the same thing as making 48 Hrs., A funny action comedy that comes into your house in a good mood and gets the reaction its supposed to get: laughs., So padded with bad jokes (many of which are homophobic), aimlessly vulgar language and hackneyed plot points that it makes its 88 minutes congeal beyond a recognizable measure of time."
Scoob!,0,"For a modern reboot, SCOOB! feels instantly dated. And its only contribution to the Scooby-Doo mythos is a thuddingly lame backstory to how he got his name., Theres a mannequin-like energy to the humans..., Grow? Scooby-Doo isnt supposed to grow. Hes supposed to cower and get the munchies. And that title!, Tony Cervones cheeky meddling with a franchise is inferior to James Bobins 2011 Muppets reboot, but its fun and will keep kids glued to the couch., The Great Danes big-screen return has murderous robot bowling pins, escapades in abandoned amusement parks and exciting airborne chase sequences - but nowhere near the joke-rate an enduring character like Scoob demands., It\s needlessly busy, featuring chases upon chases and cameo roles for other Hanna-Barbera properties (step forward, Dick Dastardly, voiced by Jason Isaacs)., Some of the updates to Scoob! feel like they are tailor-made for the viewing interests of todays younger audiences, but they land to varying success., Theres nothing new or interesting about this movie., Scoob! is a goofy and bright surprise - an imaginative reboot that respects its shaggy dog TV roots but is smart enough to add dashes, not shovelfuls, of wry pop-culture and movie references., Beyond the improved computer animation compared to the hand-drawn origins, sequences worthy of attention are too few and very far between., The other Hanna-Barbera characters that never quite achieved the cultural ubiquity of Scooby-Doo makes for a fun, universe-expanding tale, avoiding the cliches and story ruts that might otherwise befall yet another version of the Scooby-Doo story., Its really no better or worse than other selections from the genre its part of - that slice of fast-paced, brightly colored kids movie that makes no pretense of being anything other than an adequate distraction for young attention spans., Pre-sold fans - especially fans with kids - of Scooby-Doo, Shaggy, Velma, Daphne and the thud named Fred are in the bag. I dont know what to tell the rest of you., A confounding and convoluted origin story to a pretty straightforward Saturday morning cartoon., If youre a long time fan of the brand, there might not be enough fun and also depth here to really make it satisfying., Any hopes one might have of the film exceeding the low expectations set by its unnecessarily punctuated title should be abandoned forthwith., It tries to do a little too much and runs too long but its an affable mix of nostalgia and family-friendly animated action/adventure., A ham-fisted attempt to capture the zeitgeist by shoving most of the classic characters to the side and adding a bunch of superheroes into the mix., The result is something too confusing and scary for young viewers, and too familiar and repetitive for older kids., Traditional enough to please the fans but contemporary enough to address (Im not kidding) toxic masculinity and some nice reminders about the importance of friendship."
After We Collided,0,"A series of half-digested movie tropes regurgitated by Google Rom-dram., American Afternators will no doubt be similarly pleased with this slightly campier continuation of the series. For everyone else, however, there\s not enough innovation to make the second installment a worthwhile jumping-on point., Too moronic to work as a serious romantic drama and too boring to work as straightforward sleaze., After was merely awful. After We Collided is atrocious."
The King of Staten Island,0,"Every time he makes a film these days, its as if Apatow got carried away at the pick-and-mix and walked off without realising the bag has split., It\s a film full of characters who have to say I\m sorry a lot. Bottom line, though-they\re all quite recognizably and vibrantly human., If youre prepared to give Davidson a chance, Apatows entertainment instincts and a well-chosen supporting cast are enough to ensure the film never becomes an outright drag., Viewers familiar with Davidsons role as a similar good-natured yet immature loafer in 2019s Big Time Adolescence may find the typecasting unoriginal, but the fact of the matter is this: its a type Davidson shines in., ...when youve got a character like Davidsons Scott... you cant expect, if Apatow trusts us as viewers, that were going to get some totally inspirational transformation..., It works best as a tale of flawed men struggling to navigate a new world of #MeToo and mental health awareness whilst tackling the ghosts of their fathers expectations. And the uplifting pay-off is diligently worked for, even if its a long while coming., The King of Staten Island is more than a run-of-the-mill genre movie. It is a brutally honest, first-person account of what can happen to a family when tragedy strikes., A bit self-indulgent and too long...but the more I thought about it, the further I was from the film...the more stinging pathos moments came to mind...I thought it had a heart, tangible and beating..., In the latter half of the film, Apatow finally starts to home in on the point of his tale, and thats when The King of Staten Island becomes compelling and moving., All loose limbs and exposed emotional scar tissue, Davidson is persuasively raw in a performance that becomes increasingly textured and interesting..., I dont feel like this is the lightning in a bottle magic that some of director Judd Apatows films have been... But its enjoyable, if too long., There is a fascinating push-pull at the center of this, where Pete Davidson almost breaks out of the Judd Apatow template and makes a movie that feels interesting on its own., While eminently enjoyable, the film has a slightly loose and lazy quality. Storylines appear and then are forgotten for long stretches. Though the elements are individually solid, the fit between them is awkward., Judd Apatow has a history of hyper-reflexivity, turning his films into ruminations on his own world. His latest Pete Davidson-led project, though, suggests a conscious effort to change..., My reaction to Judd Apatows latest men-behaving-badly and in dire need of psychological help dramatic comedy hybrid The King of Staten Island can be summed up in three simple words: I didnt care., By the end, in truth, I found myself swamped by Scott, and wondered if he might have made more impact as a secondary character..., Within the scattered narrative, its Powleys Kelsey who comes out the winner, and the most realized character in the film... Shes the queen of this world, its the movie thats focused on the wrong member of the kingdom., While Apatow is a Hollywood powerhouse, The King of Staten Island\\ doesn\t come across as standard Hollywood product. It registers as a piece of personal filmmaking on the part of both director and star., Davidson is an exceptionally appealing performer, and it is clear he is trying to blend art and life here, using the film itself to become more vulnerable and more present., Pete Davidson plays a version of himself in this shaggy, endearing, if overlong, comedy."
Clouds ,0,"Big on hugs and scant on plot, the gentle, hazy script is jolted by dramatic moments that are quickly ushered away unresolved as if to shrug, thats life., Clouds has all the makings of a profound and powerful heart-tugger. So why isn\t it more wholly moving and cathartic?, Clouds continues to prove that director Justin Baldoni has a real passion and knack for sharing challenging true stories while honoring the real people and inspiring others in the process., This film is particularly perceptive on the issue of what it means to try to be normal under excruciatingly painful circumstances., A sweet, smoothed-over biopic of teenage singer-songwriter Zach Sobiech, who died aged 18 of cancer, shortly after scoring the viral folk-pop hit that lends the film its title., Clouds keeps its focus squarely on the ground from start to finish, and it soars that much higher for it., Director Justin Baldonis young-adult romance knows exactly which audience its playing to, and accomplishes much of what it sets out to do: break your heart, while leaving you humming a sorrowful-yet-catchy tune."
The Spine of Night,0,"The Spine Of Night is here to satiate the cravings of those who miss a particular brand of animated storytelling, updated with added psychedelic fervour and plenty of extra-gnarly bloodshed., A heady, fizzy mix that’s very watchable, probably even more so for viewers open to the use of chemical assistance., Spine is a throwback to the go-for-broke days of Heavy Metal, but unlike that multistoried fantasy this one tells a cohesive tale., The Spine of Night feels like a heroic mash note to the formerly frowned-upon taboo of watching this sort of black light/van art epic, only its now a couple decades later, and not at all better., Ditto the Bakshi-perfect animation, which transports you back to a time when stuff like this still felt dangerous., Alas, all the world-building filmmakers may contrive doesnt count for much if they dont put it across visually. And this heavily rotoscoped vision does not get where it needs to be to achieve genuine trippiness., With its fusion of naive, old-school character rotoscoping and lavishly airbrushed world-building, the films visuals aim squarely for geek nostalgia and hit their target., There is very little in terms of actual plot or pathos, but thats not why you watch this film., Writer/directors Philip Gelatt and Morgan Galen King understand that myth cycles are often awkward, disjointed, disconnected in a narrative sense but unified on a thematic level - and thats where The Spine of Night finally finds form., This is hard fantasy, made by people who clearly know and love the form., Even if its winding narrative structure and themes wont be for all tastes, its impossible not to be awed by the sheer artistry on display. The painstaking process of hand-rotoscoped animation gives a striking, epic feel to an ambitious concept., The Spine Of Night takes paying tribute to formative influences to some pretty impressive heights., In The Spine of Night, guts explode with a speed and velocity equaled only by how fast this movie blows our minds; audacious, dazzling and fierce, this is fantasy filmmaking with no limits., A hugely ambitious and bizarrely charming display of rotoscoped evil and carnage. The Spine of Night cant quite support its scattershot anthology narrative, but the themes and bold visuals make it engaging enough., Heroes seem bored whether its maleficence or magnificence that falls before them. So, while intellectually enticing and visually daring, the dogged dryness leaves a curious tale emotionally bereft."
How It Ends ,0,"The comedy worked for me fitfully; the drama didnt work for me at all., An amiable and appealing little comedy. Its sweet, sometimes a little melancholy, and sometimes hopeful., The film plays as a series of perfectly enjoyable sketches strung together, an excuse for veteran actors to chew on playful dialogue., The comedy is pitched at such a low volume that its difficult to hear., Even at a relatively brief 82 minutes, many viewers may find themselves checking their watches and wondering what could possibly be keeping that meteor., The end-of-the-world genre has enjoyed some new beginnings of late. How It Ends is one of the more thoughtful and fun of these one-way tickets., For all the indie-film grimacing humor, for all the celebs packed in for socially distanced scenes, the film succeeds most when the camera is on Liza and her younger self as they navigate the tension of trying to be alone with yourself., The film is so economical in its momentum, and its tone of comic wistfulness so uniform, that its string of tableaux rarely feels jerky., The laughs may be fleeting in How It Ends but they can be mighty cathartic., Its a pleasant enough hangout movie, and someday it may be held up as a slanted portrait of what mid-2020 felt like for people privileged enough to ignore politics. But it still feels like a minor movie in the face of a major catastrophe., Its a little meandering in structure but there is a feeling of real heart in the films idiosyncrasies and glimmers of standout comedy in Lister-Jones and Spaenys deadpan delivery., With all due apologies to the plants, animals, and 7.5bn other souls about to be incinerated in a doomsday fireball, #teammeteor., If you ever found yourself staring at an old childhood photograph, scrutinizing what your younger self was thinking in that moment, the idiosyncratically existential comedy How It Ends will leave a bittersweet aftertaste., With its sprightly take on doomsday, How It Ends might be a pandemic movie for the stage of the pandemic where it\s possible to see some hope., Lister-Jones has the precise bearing and tone to ground something this wacky and outsized, and she approaches the part with her usual blithe charm., Packed with cameos from seemingly every celebrity the writer/directors have befriended during their careers, its more breezy than bittersweet, more about acceptance and forgiveness than a movie made in 2020 has any right to be."
Bad Trip ,0,"Theres another, deeper achievement here, which is how dexterously Bad Trips half-verite concept exposes and crosses the wires of so many mainstream gross-out and/or romantic comedies..., As if to counteract the bummer of watching a raucous comedy on Netflix... Bad Trip comes equipped with its own crowd energy-a collective faith that theres no idiotic stunt that cant be pulled back from the brink of disaster., Its a delivery system for strung-together Situationist happenings, a fancy way of saying that everyday people get co-opted into highly elaborate, hilarious, smart-comics-doing-dumb-gross sh*t., Its a blunt instrument of absurdity, but thats also what makes it so much fun., Thirty years ago, these incidents may have provoked interesting reactions. Now, people just see them as opportunities for their own content., Bad Trip might be a dumb, gross candid-camera comedy, but dont be surprised if it makes you feel a little better about your world., Despite its dead ends, Bad Trip is a ridiculously fun ride., Sniggering slapstick thats two-parts biological fluids and one-part salute to the innate empathy of mankind, often in the same scene., Bad Trip knows how to stir things up, and its funniest scenes often involve real people getting in the mix, tested by the brilliant skills of André, Howery, and Haddish., If it makes you laugh (and I mean really makes you laugh) as it often did me, that can be salve enough., As you enjoy the movies gleeful outrageousness, take a moment to appreciate the strategic sophistication of some of these bits., After the laughs have died down, these jerry-rigged gotchas all seem modest in ambition, offering little more than surprise., Bad Trip is actually two films in one, although the whole definitely adds up to less than the sum of the parts., Funny in spots, but it flatlines early and gets way too gross., Bad Trip has the blithe advantage of the easygoing complementary personalities at its center., However effortful, the movies tricks are more likely to activate your gorge than your funny bone."
Pig ,0,"If you have an open mind, you will be rewarded with a melancholic and poignant story, and a superb, triumphant performance from Cage who has no trouble reminding audiences that he is an Oscar winner capable of incredible range and depth., There are few actors who could pull off this tonal balancing act as successfully as Cage... Over the years, some have questioned how far hes in on his own joke -- but at this point, theres no doubting his finely tuned sense of the ridiculous., A deeply moving film with twists and turns that few could see coming, Pig is - amongst other things - a timely reminder of just how good Nicolas Cage is at his job., Though the film is teed up as a kind of John Wick-style revenge bender, Cages star persona is soon smartly subverted., Pig shouldnt be a revelation to anyone whos been following these mens careers, but its a perfect reminder of how easily we can underestimate people., Action-packed and yet gently meditative., His most contemplative performance in years, a reminder of a time when David Lynch hailed Cage as the jazz musician of American acting., This is the movie for which the term sui generis was invented., Anyone whos been keeping faith with Nicolas Cage, through all his careers snaking cul-de-sacs and mad escapades, has a tremendous reward in store when they sit down to Pig., Cage is as mesmeric as ever, showing off his chops, as it were, with a slow performance to match a story about a character devoted to slow food and locavore authenticity., An outstanding debut. Pair with wine and someone you love., Quiet, unforced and delicate, Pig provides a forum for Nicolas Cage, one of our most dazzling showmen, to get serious and burrow more deeply into his talent than he has in years., Photographed in the way of so many modern indies, with a sickly color palette and dim lighting that prosaically emphasizes the natural environs over people\s faces. (A good friend of mine termed this aesthetic Vimeo-link Cinema.), Pig is set in the world of foodies, but it is an Americana fable with a much broader moral..., Cage is magnificent. This is a restrained, intuitively measured portrait of a lost man rediscovering forgotten facets of himself as he goes on this surreal trek through a world he left in the rearview mirror ages ago., The character that Cage portrays is incoherent, illustrative, and ludicrous, and yet his portrayal makes the movie., Cage offers something genuinely special: a perfect performance, and one which could not exist without every other performance that the actor has ever delivered., A bittersweet and often surprisingly tender exploration of food, creative expression, and human connection., An odd but very effective and evocative character study., Pig is a thoughtful, well-made movie for an audience primed for junk: It\s pearls before swine."
