Year,Movie Title,movie,formatted_name,top_critics,_merge
2016,The Love Witch,The Love Witch,the_love_witch,"['A hilarious and pointed examination of sexuality through meticulous retro pastiche with some highly entertaining performances, The Love Witch revels in its blend of thoughtfulness with B-movie camp.', 'A side-swiping original that deserves its inevitable cult status.', ""The film offers a brilliant spin on the genre's despicable gender politics, all the while relishing in the pleasures of its outmoded visual style."", ""Even if the climax doesn't quite have the kick we might hope for, cult status surely awaits this bewitching oddity."", 'A note-perfect parody of the British Technicolor horror films of the Sixties.', ""The Love Witch goes beyond camp, beyond pastiche; it ignites the pulpy surfaces of its tale and produces a smoke of bad-dream sexiness and scariness. It's a B-movie with A-grade potency."", 'The mix of am-dram solemnity, grand guignol and Terpsichorean time-tripping is hypnotic.', ""Even in the film's most far-fetched moments, Biller has trenchant points to make about conservative, middle-class America's fear of female sexuality and the double standards that apply to men and women's romantic behaviour."", ""A genre-stretching horror melodrama crafted with extraordinary detail and style. A touch languid, it's also mesmerising, provocative, unsettling and sensual."", 'This is not a potion fit for everyone, but for a select few, The Love Witch offers powerful magic.', 'A modern feminist horror tale that rewards deep exploration beneath its admittedly beautiful surface. What looks like it might be simply a pure exercise in style not only invites multiple viewings, it requires them.', ""There's nothing like The Love Witch, and that's a good thing, for if there were, I seriously doubt I'd be as captivated with this marvelous bit of murderous whimsy as I most assuredly am."", ""Biller's visual splendor is ... wasted on a mediocre script riddled with structural problems. Scenes follow another willy-nilly, as if moved around late in the process."", ""It's like a Bewitched episode stretched out to two hours. But boy, is it gorgeous to look at."", 'Is ""the Love Witch"" a parody? It sure feels like it. But I\'m not sure Biller intended it to be one.', ""It's a lot of fun."", ""While The Love Witch leans heavily on its inspirations, it isn't like anything you've seen before."", 'The fear of female sexuality has been a staple of horror movies forever, but ""The Love Witch"" does more than simply subvert or parody the erotic underpinnings of the genre.', 'As with giallo, ""The Love Witch"" features deliberately wooden acting, and can be a little boring at times. But it\'s a stunningly photographed, fascinating reinterpretation of classic melodrama.', ""It's cloaked in a retro wardrobe and soundtrack (much of the music, by Italy's Ennio Morricone, is sourced from '60s thrillers) but loaded with irony and a fluid sense of identity.""]",both
2016,13 Hours: The Secret Soldiers of Benghazi,13 Hours: The Secret Soldiers of Benghazi,13_hours_the_secret_soldiers_of_benghazi,"['The emotional component is cheapened, at least partially, inserting a level of bad taste into the proceedings I found difficult to get past.', 'Makes American Sniper look positively pacifist by comparison.', 'Punishingly paced, flimsily constructed, and tackily executed, with the subtlety and panache of a third-rate 1930s melodrama.', 'If you are looking for an immersive action thriller, this will do the trick.', 'Bay certainly has a style of his own, albeit one that again harks back to the 1980s -- an even more cartoonish variant on the music-video bombast pioneered by directors such as Tony Scott.', 'Unsurprisingly, survivors of the incidents depicted have dismissed the film as utter nonsense. Even if this were not the case, the film-makers have some explaining to do to the military folks Bay presumably seeks to honour.', 'I went into the film knowing almost nothing about the September 2012 attack on an American diplomatic compound in Libya and came out knowing even less.', '13 Hours: The Secret Soldiers of Benghazi is a movie for anyone who saw The Hurt Locker and thought, ""You know what would make this really good? If they got six really muscley dudes with machineguns to come in and blow away all the Arabs.""', ""It's undeniably spectacular in its own juddering, pyrotechnical, Armageddon-ish fashion, but it's also a film that leads a very rancid taste."", 'The title should give you some idea of how long this two-and-a-half hour film really feels.', ""Once you get past the suspicion that he's going to glance wearily into the camera at any moment, [Krasinski is] highly believable as the semi-reluctant combatant in a battle that looks impossible to win."", ""Everything you'd expect from Bay is here with bells on - the macho provocation, the sound and fury, and the diabolical pleasure in reducing everything to rubble and bloody mush."", ""It's all so hateful. Hates women. Hates talking. Hates tact. Loves guns."", ""The final word on this incident will require a more thoughtful filmmaker. But hopefully, that artist will possess at least half of Bay's punishing, peerless craft."", ""The movie is imperfect and overlong but it's never boring. And, although aspects of its factual accuracy can be called into question, it does a decent job of chronicling what happened that night."", ""Several critics have given 13 Hours a pass, citing Bay's skill at action engineering. It's his failure at everything else that makes this movie as hard to endure as it is impossible to believe. #helpme"", '[Bay] does well here what he always does well: He keeps the action at full throttle. This is also what he does so annoyingly: He always keeps things at full throttle.', '[Bay] is hell on manly banter amid the explosions (""Just another Tuesday night in Benghazi""), and also moments carefully calculated to make you feel the horrors - and the heroics - of war. Emphasis on ""calculated.""', 'Bay\'s action sequences are as riveting and technically beautiful as ever, but his reductive worldview is also on display. ""13 Hours"" doesn\'t just lionize its American soldiers, it oozes disdain for everyone else.', ""13 Hours presents itself as a straightforward war film, but that's the last thing a subject this complex needed.""]",both
2016,Jane Got a Gun,Jane Got a Gun,jane_got_a_gun,"[""What is here is enjoyable if taken on its own terms, much of Jane Got a Gun playing out with a 1940s or '50s Hollywood lan I found more than satisfying."", ""Is it possible that Natalie Portman can't act?"", ""There's hardly a scene you watch without wondering, and doubting, if Ramsay would have done it quite this way."", ""It's all perfectly passable, but rather perfunctory ..."", ""This was a troubled production. Scottish director Lynne Ramsay quit days before shooting began and there were late changes made to the cast. In certain respects, the replacement director Gavin O'Connor has done an impressive job."", 'A very moderate adventure.', ""O'Connor once again proves that he can mine femininity just as effectively as he explored masculinity in Pride and Glory (2008) and Warrior (2011)."", ""Jane Got a Gun is being sold as a rousing feminist Western although the truth is that it's about as rousing and feminist as my cat, Daphne, who is 17, and now barely moves."", 'Feels as though everyone involved forced themselves to grit their teeth and get on with it.', ""You have to feel a certain sympathy for a project as cursed as this one, but there's no denying that Jane's gun barely grazes its target."", ""O'Connor's movie is too sentimental and self-serious to add much of note to the mythos, but Portman embodies her character's grief no less movingly than her forebears."", 'It constantly blunders into stylistic choices and narrative clichs that sabotage the sturdy two-hander at its center.', ""The movie isn't terrible, so it can't qualify as a hate-watch. It's just dull."", 'At times, Jane Got A Gun comes perilously close to staying passive-to becoming A Gun Was Gotten By Jane.', 'As stripped-down, revisionist Westerns go, ""Jane Got A Gun"" may not have reinvented the wagon wheel, but it rolls out as a sturdy, well-crafted genre piece despite its rocky road to the screen.', 'Whatever feminist angle the film might have once aspired to is lost in its listless shuffle.', 'A Western with potential for feminist table-turning and old-fashioned violence, ""Jane Got a Gun"" is a major letdown. Despite being co-produced by Portman, the movie sells her character short at nearly every turn.', 'The Weinstein Company may have unloaded this embattled Western without fanfare, but it should still appeal to genre fans.', 'This scandal-plagued project overcame the odds to deliver an earnestly felt actioner. ... Thankfully, [it] isn\'t another historically revisionist, grim-dark bleak-a-thon like, say, ""The Revenant"" and ""The Hateful Eight.""', 'Jane Got a Gun is a slow fuse of a film that burns to a whimper instead of an explosion.']",both
2016,Bleed for This,Bleed for This,bleed_for_this,"[""Teller is appreciably committed to the character, but he's only given one note to play, his full-bodied passion wasted on a movie that would rather win on points than go for the knockout."", 'Younger jacks up the action in the last third, but the air goes out of a fight movie when you can see the next jab coming.', 'Bleed for This is still worth seeing, despite its familiar trappings.', 'Bleed For This is twelve rounds of tedium, a boring boxing movie that draws most of its strength from memories of other, better experiences.', 'A solid, but unremarkable drama.', 'No flatfoot, no knockout, writer-director Ben Younger\'s ""Bleed for This"" wins on points.', ""The glove drama grand guignol comes straight from grandma's kitchen -- hot-chestnut hokum, sizzling clichés."", ""Although it's debatable whether we need another boxing movie, or whether there is anything new that can be added to an overcrowded genre, this serviceable true-life comeback story has a couple of things in its favour."", ""There is... something intriguing in Younger and Teller's understanding of the film's hero. An all-round addict who frequents sleazy strip clubs and gambling dens, Vinny's rage against impossible odds is both admirable and utterly crazed."", 'The worst thing about boxing films is the boxing... Bleed for This, thankfully, knows these pitfalls.', 'Middleweight, non-intelligence-insulting fare right to the core, Bleed For This keeps you squarely in your seat, but barely once excites you enough to leap up out of it.', 'It never questions or qualifies its upbeat message, but it\'s watchable, well-crafted stuff, strongly acted, with a very funny opening ""weigh-in"" sequence, as Vinny desperately tries to sweat off excess pounds with minutes to go.', 'It may be predictable, but Bleed For This still grabs with its astonishing against-all-odds true story, and its belter of a central performance from Miles Teller.', 'Bleed For This is an enjoyable but very generic and old-fashioned boxing movie.', ""A journeyman effort that's satisfyingly light on melodrama."", ""Ben Younger's Bleed for This, starring Miles Teller, distinguishes itself by doubling down on some of the tried-and-true formulas. It's a comeback times two."", 'Bleed for This is utterly devoid of tension, making for a limp entry in the fighting-film lineage.', ""Bleed for This will not be the drama that establishes Teller as a heavyweight in Hollywood. And that's a real shame for its true champ, Aaron Eckhart."", ""There's always another fight, just as there's always another boxing film."", 'Teller is magnetic in the lead role, and he helps ""Bleed for This"" transcend boxing movie clichés.']",both
2016,Barbershop: The Next Cut,Barbershop: The Next Cut,barbershop_the_next_cut_2016,"['This one, thankfully, boasts some welcome new cast members (including the rapper Common and Nicki Minaj), a new director in Malcolm D Lee (the cousin of Spike), and a fearless approach to difficult subjects.', 'Barbershop: The Next Cut brings topical social issues into the narrative but only starts meaningful conversations without genuinely pushing them forward.', 'What most captivates is the rhythm of those scenes in which the characters mount the soapbox to share stinging observations on a variety of topics in an often hilarious back-and-forth battle of words.', 'The fourth entry in the Barbershop franchise delivers keen social commentary, bringing back many of the key players from the 2002 and 2004 installments.', 'Leaving aside the humorous cultural escapism of the early aughts, The Next Cut faces the racial and political issues of 2016 head on.', 'This Barbershop is simply a place where we can all laugh together, sometimes at ideas that veer close to being explosive.', ""It's refreshing to encounter a sequel that leans deeper into sociopolitical realities, not further away."", ""The movie deals tangentially with #BlackLivesMatter but what it's really about is the space: a place where a community can get together to share their anger, pain, faults and joys. That matters too. That's what these movies are."", 'What makes it work is the talk, the constant banter that sways in and out of heartfelt discussion of all the big issues: race, gender, politics, community, family, and love.', ""It's stagey, often simplistic and it talks too damn much. But, hell, the talk has flavor and snap and a real-world sense of a community in crisis. Not bad for an escapist romp."", 'Next time? Just a little off the top please, and leave the socio-political commentary to others.', 'The cast has a natural chemistry and the shop has an authentic feel. Even as things get preachy, the quips keep customers coming through the door.', 'Instead of offering easy answers, Barbershop: The Next Cut raises important, difficult, and timely questions.', '""The Next Cut"" manages to be entertaining and thoughtful, harmless fun but just serious enough not to seem frivolous.', 'As politically savvy as it is raucous and funny, Barbershop: The Next Cut is a stylish cut above its predecessors.', ""A moderately funny but uncommonly focused ensemble comedy, this isn't just a movie about the gun violence that plagues Chicago's South Side, it's a movie that was made in response to it."", 'For a freshly-shaved-chin wag, ""The Next Cut"" covers ambitious ground.', 'Just about everything else clicks, thanks in no small part to the wonderful performances from the deep cast.', 'The most fascinating - and the most moving - thing about this sprawling, sincere and boisterous movie is its tone.', ""There are enough moments that feel both real and true to make one hope the latest cut isn't the final one.""]",both
2016,The Huntsman: Winter's War,The Huntsman: Winter's War,the_huntsman_winters_war,"['Even filled with flaws and missteps aplenty, I got a serious kick out of this sequel, I enjoyed it far more than I imagined I was going to.', ""The heavily female-centered The Huntsman: Winter's War boasts beautiful visual effects and a sense of humor sorely lacking from the original."", ""When people gripe about Hollywood's reliance on sequels and cheap franchise cash-ins, this is the kind of movie they mean: no Grimm's Fairy Tale, but a grim tale nonetheless."", ""By cramming far too much material into 114 minutes, The Huntsman: Winter's War feels rushed and incomplete."", ""It's certainly a beautiful dud. It's a well-acted dud. But a dud it is, and when it lands, that landing is as heavy as a big, fat, icy snowball."", 'The script lifts so much plot from Disney\'s animated Frozen that it could qualify as a remake. No one sings ""Let It Go,"" but my advice to audiences is to do just that.', ""Here's hoping that any future installment ditches the Huntsman the way that Snow White was shunted aside, because the evil queens are where it's at."", 'Freya is given the barest veil of a backstory while Ravenna just oozes ribbons of black bile (literally) for her own evil reasons. These women may be strong but they are never deep.', 'At least now we have an answer to the question, ""Who\'s the dullest franchise of them all?""', ""Sampling Tolkien, Disney, and Grimm, The Huntsman: Winter's War lays on the pastiche in slabs, but no one is slouching here."", ""Now we should worry that studios will use this movie's probable failure to discourage future female-centric blockbusters. Don't blame the stars, all wonderful in their limited capacity."", ""Blunt and Theron are game but given little to do but strut and declaim. Hemsworth is fun to watch and there are striking visuals, but that can't make up for a dreary mess."", 'Every resonant theme or intriguing story possibility is stripped away and replaced with a ready-made franchise-movie conceit.', 'Nearly every major character dies and comes back to life at least once and a convoluted narrative yields not a single, palpable moment of drama.', 'Nah, queen.', ""The Huntsman: Winter's War is as beautiful as its macho lead actor Chris Hemsworth is handsome. The movie is also as vacuous, silly and boring as Hemsworth is awkward and awful in the title role."", 'The story loses direction like forest wanderers relying on a bread-crumb trail.', 'There would be use for a properly dark Frozen retelling, more in line with the original tale, where the afflicted actually uses her power for malfeasance. But Freya is a snow day late and a dollar short.', 'It serves as both a talent-squandering prequel and sequel to Snow White and the Huntsman, while doing nothing more than name-check Snow White.', ""There is a decent movie buried in here somewhere, but with such powerhouse actresses, it's dismaying that it feels so regressive from the first.""]",both
2016,Demolition (2015 film),,,,left_only
2016,Criminal ,Criminal ,criminal_2016,"[""As a movie, there's plenty here to respect. As entertainment, however, this is tough one to enjoy, all of which makes Criminal a vexing spectacle that's hard to watch all the way through to its end."", ""It's lazy, corrupt and sleazy filmmaking, the kind of film that's killing the business."", 'We can but pray that scientists invent a procedure to remove the memory of ever watching this film in the first place.', 'Costner, in full badass mode, makes this crackpot premise work.', 'The movie is a little more fun than it has any right to be, thanks to its super-serious cast (including Tommy Lee Jones, Ryan Reynolds, Gary Oldman, and Gal Gadot) and the straight-faced approach to its ridiculous shenanigans.', ""Criminal is a perfectly passable thriller, if you're cool with no one here passing as an actual human being."", ""Criminal isn't a very good to begin with. It also wastes a solid cast."", 'All the ingredients are there for a pleasant pander to grumpy old white men: the craggy actors, the foreign bad guys wielding confusing technology, the kindness of beautiful young women, and the nobility of sacrifice.', '[A] fantastically stupid thriller ...', 'Criminal is an action-thriller with a science fiction twist. To the extent that its purpose is to energize and involve an audience, it succeeds.', ""Orange is the new black for Kevin Costner in Ariel Vroman's crazy sci-fi espionage actioner, a star vehicle that fast and furiously leaps from action set piece to action set piece in an obvious effort to avoid the giant plot holes imperiling the story."", ""It's wanton, low-down entertainment without the flair to pull this stuff off, or the neural stem cells to make wit or logic much of a priority."", ""Neither scriptwriters Douglas Cook and David Weisberg nor Vromen in the director's chair are subtle enough to figure out how to do both action and character."", 'Egregiously silly, generic ...', 'So much wasted talent. Downright Criminal, it is.', ""Half science-fiction tale, half espionage thriller, it's a pleasantly far-fetched endeavor that moves along so briskly that it leaves no time to consider its implausibilities, which are many."", ""It's best not to think about this preposterous story too hard. Just ride it to its even more preposterous climax, enjoying Mr. Costner and a steady supporting cast (Gary Oldman as the C.I.A. honcho; Gal Gadot as Bill's wife) along the way."", 'A violent Kevin Costner B-movie.', 'Costner carries it off with a certain growly-voiced deadpan. Like Liam Neeson, he could get a late-career boost in the action genre. But the extreme ridiculousness of everything lets it down, and the violence is deeply misjudged.', 'Criminal is a screwed-up mess as a story and as an action movie with a so-called moral lesson in it. In fact, the more I think about it, the less I like it.']",both
2017,Megan Leavey ,Megan Leavey ,megan_leavey,"[""The film's gendered Orientalist narrative uses Iraq, its people and the US-led war there as the backdrop for a story about a white woman soldier finding herself and learning to love through her combat canine."", ""A heartfelt and touching film featuring one of Kate Mara's best performances."", ""Kate Mara is raw and riveting in the title role, a marine who ends up in combat in Iraq with a bomb-sniffing German shepherd. It's a true story that earns your tears."", ""Director Gabriela Cowperthwaite's spare handheld camera work comes into its own once the canine teams are out in the field."", ""Cowperthwaite is a documentarian and brings a low-key naturalism to the storytelling, and Mara is excellent in revealing Leavey's growing sense of confidence and purpose."", ""If you're looking for a good cry, Megan Leavey gets the job done, I suppose. But it's a bit like a wet kiss from a puppy."", 'The film - the feature directorial debut for Gabriela Cowperthwaite, whose orcas-in-peril documentary, Blackfish, struck a nerve - treats the handler/dog relationship with respect, not cheap sensationalism.', 'With a female-directed, female-driven film this small, criticizing it feels like beating a baby seal. While well intentioned, the human-and-dog interest story lacks narrative drive and star Kate Mara is a limp noodle.', ""The emotion in Megan Leavey is not forced. It flows, up and down the leash, just like it's supposed to."", '""Megan Leavey"" works because it takes Leavey seriously as a character, and it studies her journey through her life and through the Marines before Rex is even a factor in the story.', 'May not be the smoothest piece of filmmaking, but wears its emotions honestly and benefits from offering a look at a rarely explored arena of human-animal relationships: dogs trained for combat.', ""If the conclusion doesn't bring a tear to your eye, you're way too cynical."", ""Megan Leavey isn't flawless in its structure and thematic priorities, but what it has is a worthy tale of commitment and bravery, which satisfyingly wraps up in a touching finale."", ""As it stands, the movie's power never pops off the screen."", ""Kate Mara imbues the role with plenty of grit and pluck but it's Rex, the dog she bonds with, who turns out to be a natural in front of the camera."", 'This movie is rarely more than merely competent, but it should stir lovers of justice as well as dog fanciers.', 'This is a good story, well told.', 'This is an affecting story about loyalty, sacrifice, and the forging of identity.', ""If you have a soft spot for dogs, this is a love story you'll find irresistible."", ""This is a film that can't decide if it wants to be a war movie or a rescue dog melodrama and therefore falls into cinematic no-man's/woman's-land.""]",both
