Year,Movie Title,movie,formatted_name,top_critics,_merge
2013,Side Effects ,Side Effects ,side_effects_2013,"['Steven Soderbergh has crafted a meticulously treacherous Hitchcockian thriller; the atmosphere crackles with sexual tension and betrayal. ', ""Dr. Banks' battle against evil lesbian scheme-hatchery sculpts him into a perfect husband, father, and doctor. It's surprising there isn't an epilogue to the film of him undergoing yet another transformation-this time into a saint, or maybe Superman."", 'Side Effects showcases much of what the just 50-year-old filmmaker does best.', 'Just when the film seems to have settled into that particular rubric, it sidesteps into a different bad-dream scenario... Which is where Side Effects starts getting slippery to a fault, and seriously problematic with it.', 'It is, when the end credits roll, a sold, sturdy little mystery - sleek, and more than a little junk-foody.', 'A chilling, disturbing portrait of the dangers of the pharmaceutical industry, as well as the evil of deceit.', ""It's difficult to escape the impression that the movie is impressed only with its cleverness."", 'Side Effects is a more than worthy film for anyone to end their career (well, maybe) on.', ""If audiences stop trying to unravel the very tangled plot and don't mind have the carpet pulled from under their feet again and again, they should find plenty here to relish."", 'Once Side Effects gets into its crime story, medication is swept aside by movie nonsense. The storyline goes into tangles that have to be dealt with very rapidly if the audience is not to start laughing.', 'If this puzzling, often very enjoyable medical thriller were directed by almost any film-maker other than Steven Soderbergh, you would be tempted to diagnose it with genre identity disorder.', ""This movie is pure hokum, just as Hitchcock's great originals are, but you only realise this after - just like all the people in the film - you have been thoroughly hooked and duped yourself."", 'A mischievously enthralling trip ...', ""What a gripping and disturbing thriller this is. Surely it can't be Soderbergh's last movie. Say it ain't so."", ""Opts for raucous frivolity over genuine substance. But it's great fun while it lasts."", 'The instability bleeds into the fabric of the film itself, and until the very end, it is thrillingly hard to prise open its puzzle-box lid.', ""As a thriller in the Hitchcock mould, 'Side Effects' is great fun: its characters are well acted without being entirely likeable, which makes their jeopardy all the more enjoyable while putting us at a clinical remove."", ""We may lose Soderbergh to painting, theatre and HBO-fuelled TV, and that's a crying shame. If that's the case, Side Effects is a great note on which to go out."", 'Soderbergh is less interested in making statements than he is in skillfully fulfilling genre expectations.', ""When all's said and done, it'll go down as minor Soderbergh - clever sleight-of-hand, really - but it reminds you of so many Soderberghy virtues as to be an oddly compendious pleasure.""]",both
2013,Rush ,Rush ,rush_2013,"[' Howard creates a persuasive sense of the time and place, and the race sequences are impressively mounted. This is thrillingly tense stuff, even if you know how the story panned out.', 'While it has its moments of sentimentality, the film as a whole is rather shallow and fails to capture the soul of either man.', 'This thrilling drama is no more for petrol-heads only than Titanic is solely of interest to historic ship enthusiasts.', ""Rush is pure 'print the myth' stuff -- but since both its heroes really are myths, it gets away with it, with more grace and vigor than you might expect."", ""An entertaining movie with two solid performances that only occasionally stalls because of its sometimes heavy-handed treatment of Hunt and Lauda's differences."", ""Considering the subject matter, Rush delivers the expected visceral jolts; what's surprising is how endearing it is, even when its two protagonists are behaving like little more than boys with very fast toys."", ""The script is another Peter Morgan special. Like, say, The Queen and Frost/Nixon, it's a speculative duet built around a moment of newsworthiness."", ""If you don't already know the story of that season, lucky you; even now, it exerts a ridiculous thrill."", 'Rush is an outsize Hollywood spectacle about two outsize personalities in conflict, a sleekly assembled thrill machine that makes up in excitement for what it lacks in nuance.', 'Rush is not a particularly deep film. But more importantly, it is not a film that mistakes itself for deep. And this self-knowledge makes Rush, in some ways, a wiser film than many that aspire to loftier goals.', ""The British Hunt is Maverick to the Austrian Lauda's Iceman, the Michael to his Sonny, the id to Lauda's superego."", 'Ron Howard has brought this story to life with unbridled energy, transforming each race into an adrenaline-charged vignette that could serve as a master class in staging and editing action scenes.', 'Stripped-down characters and skeletal dramaturgy limit this movie about the real-life Formula 1 racing rivalry of James Hunt and Niki Lauda, but harrowing track scenes and an affecting second half provide some vivid compensation.', 'This is a deeply adult drama, not least because Howard shows the costs of being so driven in a sport in which a driver is encased in a potential fireball.', ""Rush may begin as a two-man race, but Brühl's Lauda wins by a landslide."", 'One thing\'s for sure with this film: You carry the ""Rush"" out of the theater.', 'Rush has an elemental simplicity about it. Two men in competition, driven (so to speak) to win. They are enemies. But they need each other, too, and as they roll around at 170 m.p.h., they come to understand why.', '""Rush"" is the kind of Hollywood studio production that has sadly become all too rare - a smart, exciting, R-rated entertainment for grown-ups that quickens your pulse and puts on a great show.', ""'Rush' ranks among the best movies about auto racing ever made, featuring two great performances from the leads."", 'This is no mere thrill ride by two real-life rival speedsters, although it is certainly that. The film also provides a sobering look at what it takes to be a true champion.']",both
2013,Oz the Great and Powerful,Oz the Great and Powerful,oz_the_great_and_powerful,"['Make no mistake, Oz the Great & Powerful a beautiful film... But any true weight of vacancy rests in the script itself - and no feats of acting could have fundamentally changed this trap.', ""With flying monkeys, Yellow Brick Road and sequin-spangled witches all faithfully reproduced, it's impossible to see this as a standalone film, given it looks like an HD colouring book version of the original movie."", 'The twister that comes to whirl Oscar into Oz is so preordained you could find its departure information and flight time from an airport travel board.', 'This eye-filling fantasy is an entertaining riff on how the Wizard of that immortal film found his way to Oz.', 'An imaginative mix of live-action and CGI that pays homage to the iconic images and timeless sense of wonder in the classic The Wizard of Oz without being too deferential.', 'How refreshing it is to enjoy something we never knew we wanted.', 'I was a bit skeptical about the casting of James Franco in this role, as a small-time carnival magician, but he is thoroughly engaging as a struggling con man and charmer.', ""Oz the Great and Powerful is entirely serviceable family entertainment. Problem is, serviceable doesn't quite cut it when you're talking about the magical land of Oz."", ""Aside from a trio of witches that can hold its own with Eastwick's in the dishiness department, Oz the Great and Powerful is a peculiarly joyless occasion."", 'Let us take a moment to praise two great and surprisingly powerful characters: a winged monkey and a wee girl made out of china. Because so much human wonder resides in these two creations of make-up, puppetry, digital effects and lovely performances.', ""The new Oz falls short of the 1939 Oz in charm and innocence, and certainly in songs. But as family entertainment, it's hard to fault such a rapturous spectacle and astute, suspenseful piece of storytelling."", 'Oz the Great and Powerful somehow manages to be both slavish to its hallowed template (when convenient) and completely tone-deaf to the magic that made it a one-of-a-kind cultural milestone.', ""Raimi's film is supposed to be about magic, but magic is in scant supply."", 'The screenplay is not perky enough and Franco is miscast. Added to that, the three witches needed lessons from Macbeth to fully convince.', '""Oz the Great and Powerful"" will likely dazzle family audiences while satisfying movie purists. Somewhere over the rainbow there may be a more magical movie, but this will certainly do.', 'By the end of the two-hour 10-minute movie, director Sam Raimi proves he understands spectacle but not the deeper dreams of the people who consume it.', 'A Blunder-full Blizzard of Blahs.', ""It's a journey of self-discovery, rife with movie cliches about believing in yourself, believing in your dreams, yada-yada."", 'The real star of the story is the enchanting, rapturously imagined setting.', 'Oz the Great and Powerful aims for nostalgia in older viewers who grew up on The Wizard of Oz and still hold the classic dear while simultaneously enchanting a newer, younger audience. It never really accomplishes either successfully.']",both
2013,Delivery Man ,Delivery Man ,delivery_man,"[""A sentimental exploration of what fatherhood means that doesn't overdo it with the sperm gags, it's a rather charming if unexceptional dramedy."", 'The tone wavers between the pantomime and the mawkish and while little has been lost in translation, less still has been gained.', 'Alas, the hero is played by Vince Vaughn, a limited actor whose range extends from petulant to homicidal.', 'Vince Vaughn autopilots his way through this lame, contrived and strangely depressing high-concept comedy.', 'A one-man show of ill-firing jokes, fizzling double takes and misty-eyed attempts at sentimental wrap-up.', 'If you want something truly gruelling, try the new Vince Vaughn comedy.', 'A golden comic premise, directed to dross by Ken Scott, who also made the Canadian original (""Starbuck,"" from 2011) on which this Vince Vaughn vehicle is based.', 'Softer and schmaltzier than the original. Vince Vaughn has played this guy before, to better effect.', 'Unlike most Hollywood remakes of foreign-language pictures, ""Delivery Man"" was made by the same filmmaker responsible for the French-Canadian hit ""Starbuck.""', 'Calling Delivery Man a ""comedy"" is a bit of a stretch, because it\'s rarely funny. Dumb, yes, but not in a way that\'s worthy of more than a half-hearted chuckle.', ""Even noting the toned-down performance of Vaughn and the film's overall amiability, there are some creepy and unexplored issues lurking in the margins of this story that can't be brushed away."", 'Delivery Man can be pegged as yet another in a seemingly endless series of Apatow-era man-child redemption stories ...', '""Starbuck"" was a funny and warm-hearted trifle. So is ""Delivery Man.""', ""Nothing quite seems to fit, as if the movie's been assembled from bits and pieces of other movies."", 'Delivery Man, with its democratic band of half-siblings and its feel-good view of humankind, is what it is: a reproductive remake that will make you laugh. More than once or twice.', ""It's all far-fetched, silly and light. But then it's supposed to be."", 'Vince Vaughn can be a ray of sunshine in even the worst movies (see ""Be Cool"" for the best example of this). Here, I just didn\'t buy him as a loveable sad-sack.', '""Delivery Man"" is nowhere near the worst film of 2013, but it is definitely the most exhausting.', ""Let's just say, whatever your mood going in, you will likely feel a good deal better coming out."", 'A soggy comedy more focused on stimulating your tear ducts than your funny bone.']",both
2013,Aftershock (2012 film),,,,left_only
2013,The Fifth Estate ,The Fifth Estate ,the_fifth_estate,"['Given its own aggressive attention deficit disorder, The Fifth Estate is the sort of movie that might induce a migraine.', ""Those in the know say Cumberbatch's performance captures the physical Assange perfectly, but the film fails to get a handle on him as a personality, or offer any kind of insight into what his true motivation might be."", 'Tthe film finally falls short, an explosive beginning leading to a pedestrian end.', 'As nervy and as excitable as the trade that it depicts.', 'The material covered in the production\'s 128 minutes is not only inherently non-cinematic but not remotely ""thrilling,"" at least in the conventional sense.', ""The bullet points of WikiLeaks' rise and fall are dutifully covered, but the movie bites off more than it can chew..."", ""The Fifth Estate is also as current as a news feed, filling in the disputed facts about Assange's life beyond the headlines and chronicling the revolution that has upended the media landscape in the last decade."", 'Director Bill Condon delivers an intelligent, dynamic, character-centered drama.', ""Condon and his screenwriter Josh Singer don't quite know what to make of this duo, perhaps because the men didn't quite know what to make of each other, either."", '""The Fifth Estate"" feels unfortunately small and safe.', 'A feeble, reactionary drama.', '""The Fifth Estate"" tries to be a cross between ""The Social Network"" and ""Zero Dark Thirty."" Only it\'s more like ""The Sociopath Network"" meets ""Zero Dumb Thirty.""', 'It may be a bit chilly, but ""The Fifth Estate"" is good, scary information well-processed.', ""The problem with director Bill Condon's fictionalized account of all this is that, like WikiLeaks itself, there's way too much data to sift through."", 'The Fifth Estate takes on the important 21st century question of information flow vs. privacy rights and fumbles it into a middling mishmash of techno thriller and future-of-journalism lecture.', 'Like the journalists Assange worked with, it tries to put some shape and perspective on a story that is still too big and too new to frame as a definitive narrative.', 'The first narrative film portrait of the white-blond cyber bad boy feels undercooked and overwrought, haphazardly written and overdirected.', ""Benedict Cumberbatch restores mystery to the personality of WikiLeaks' founder, Julian Assange, and fascination to his role as a global crusader for free speech."", 'As much it claims urgency with current events and issues, it seems out of date, even coming just three years after the real events.', ""The movie can't quite decide what it thinks of [Assange] - or even if it should decide at all.""]",both
2013,Clear History,Clear History,clear_history,"[""The high points - especially a brilliantly worked running gag about soft-rockers Chicago - are spread too thinly, and David's improvised comedy of embarrassment is now very familiar."", 'The revenge plot brings the characters together...and doesn\'t come together as satisfyingly as your average ""Curb"" episode... [but] the funny parts of ""Clear History"" are good enough to act as an acceptable 100-minute substitute.', 'For those of us who agree with Mel Brooks that ""there\'s something about this middle-aged bald guy that\'s thrilling,"" his new film is a high-spirited treat - and a hint at the possibilities that await him if and when he finally calls it a day on \'Curb.\'', 'It will take only a few minutes of Clear History... not only to ""forgive"" David for repeating himself but to thank him for reminding us why we miss Curb Your Enthusiasm and hope it comes back soon.', '[It] has a nice, confident and well-edited breeze to it (including a lot of jokes about the band Chicago), with a fun cast that includes standout riffs from Michael Keaton, Danny McBride and Eva Mendes.', 'A wonderfully diverting film with Mr. David at his abrasive best.', ""If you're a fan of Curb Your Enthusiasm, think of this as an extended version of Curb. If you're not, History will not convert you."", 'Clear History was improvised from 35 pages of script. ""You are such an a---!"" one Vineyard resident tells Flomm, which is the movie\'s main revelation.', '""Clear History,"" a memorable comedy about a man trying to be forgotten.', ""Even if you do like David's shtick, as I do, you have no business here."", ""Clear History is amusing enough to pull a viewer through it, although those who haven't yet acquired a taste for Curb might find it the equivalent of a pricey two-drink minimum without enough payback."", 'The movie also feels at time like an extended all-star jam episode of Curb. Those are, perhaps not coincidentally, the best, and funniest parts of Clear History.', 'As the movie proceeds, it gains traction, first as a kind of pleasant alt-Woody Allen vehicle... and then as a well-modulated morality play.', ""Despite a number of funny lines sprinkled through the script, this History isn't very memorable."", ""It's hard to fault HBO for letting him indulge in this flight of fancy, particularly given all the marquee names he attracts. Still, without an ability to focus those appetites, Clear History yields the occasional chuckle, but somewhat curbed enthusiasm."", 'Clear History is so funny it made me want to order up some Palestinian chicken.']",both
2013,Monsters University,Monsters University,monsters_university,"['It is essentially Revenge of the Nerds, with fur. And scales. And whatever gooey, gelatinous substance comprises the outer coating of various other oddball creatures in this crazy parallel world.', ""Studios don't often seem to be thinking about the ideal moviegoer, just about the maximum number of moviegoers ... Pixar is no different in that regard, but even in this relatively fallow period ... it's never stopped thinking the most of us."", ""So many movies, these days, are about nerds and their market value. Dan Scanlon's prequel is the newest, but already feels old."", ""It's a strong look at the genesis of a satisfying partnership, but it could be stronger if it trusted that partnership to carry the story."", 'It is funny. But the longed-for return to Pixar greatness seems as far away as ever.', 'After an hour it starts to feel like Harry Potter gone wacky and gonzo - and not quite wacky and gonzo enough.', ""It's not that Monsters University lacks any of the heart or wit of Pixar's finest achievements - the attention to detail and sight gags are as impressive as ever - but narratively speaking this is derivative in the extreme."", 'The story is so fully and elegantly realised that to call it a prequel would somehow feel like an insult.', ""It has enough of the right stuff to haunt the imagination long after the immediate buzz of its fluffy-furred cuteness has melted away. For a mere prequel, that's a result."", 'Dazzlingly clever and hugely funny, it succeeds both as a broadening of the Monsters universe and as a film in its own right.', 'This is a safe, predictable, edge-free, nearly bland effort from a studio that rarely hedges its bets.', 'As prequels go, Monsters University is pretty nifty.', ""Although it falls short of the best Pixar has brought to the screen over its long association with Disney, it's nevertheless worth a trip to the theater, especially for kids."", '[It] is true to the spirit of the original film, ""Monsters Inc."", and matches its tone. But it never seems content to turn over old ground.', '...I can applaud a story that not only celebrates oddballs and underdogs but shows how young outcasts can find their way in the world...', ""It's not like Monsters University is a bad movie. It's just not a terribly interesting one."", 'A charming, well-crafted trifle - at least until the subversive last act, when it sets its sights a bit higher.', ""[It] conforms to [Pixar's] apparent drift toward the average, with toy sales taking priority over originality."", '\'Monsters University"" is an imaginative, raucous, wildly inventive cartoon of a movie.', ""What hasn't advanced is the plotting, which was nothing special last time and is so formulaic now that it's basically surprise-free.""]",both
2013,What Maisie Knew ,,,,left_only
2014,Decoding Annie Parker,,,,left_only
2014,4 Minute Mile,4 Minute Mile,4_minute_mile,"['A by-the-numbers tale of inspiration through perspiration.', ""4 Minute Mile at least has the decency to acknowledge that it's aware of its underdog sports-movie clichs, especially the ones that made The Karate Kid such an '80s classic."", ""More than one interior scene looks underlit for effect,but that's at least something else to think about as the film goes through its paces."", ""It's a moving, if occasionally heavy-handed, sports drama that deserves a wider audience than it is probably going to find in its limited release."", 'A finely written and directed sports drama with a lead performance by rising star Kelly Blatz so deep and affecting it often evokes Timothy Hutton\'s Oscar-winning turn in ""Ordinary People.""', ""There's a similar redolence to 4 Minute Mile overall-the odor of a hard-working but underachieving movie that's 99 percent perspiration and 1 percent inspiration."", 'A sympathetic performance by Richard Jenkins does little to dispel the stale atmosphere here', '4 Minute Mile is cobbled together with every sports underdog clich imaginable.']",both
2014,Open Grave,Open Grave,open_grave_2014,[],both
2014,Inherent Vice ,Inherent Vice ,inherent_vice,"[""If I'm going fawn over a puzzling film, I'd rather it be something like Inception or The Matrix, movies that entertain me but also provoke so much thought and analysis that I can't take my mind off it."", ""If the adaptation's a little too faithful to sustain a cinematically tight story, there's still a lot to admire in the sheer, uninhibited folly of the whole thing, the gall to get groovy while the Oscar-watchers are on high alert."", 'After a decade spent making two films that are like pressure cookers, Anderson was clearly ready to blow off some steam.', ""It isn't one film but many, an anthology of expertly recreated genre tropes, from fog-shrouded noir to sunlit paranoia."", 'I found myself going with it for about two thirds of the time, seduced by its sweetness, suspicious of its sexuality ... occasionally exasperated by its incessant shaggy-doggedness.', ""The thing Inherent Vice has going is its sense of always plucking at the fringe, the conviction that the central characters aren't necessarily the most interesting ones."", 'I think I need to see it again, again.', ""Watching Paul Thomas Anderson's wonderfully textured and intricate LA-set Inherent Vice, you are easily reminded of the famous story about Howard Hawks' version of The Big Sleep."", ""Not knowing quite where the joke is doesn't stop us from finding it funny, any more than confusion should preclude our wistful appreciation."", ""Paul Thomas Anderson's Inherent Vice provides a rush of pure hallucinogenic pleasure, but its logic is mighty hard to follow."", ""The less you try to figure out Anderson's rambling, mesmerising mystery, the better. Just relax and let this beautiful, haunting, hilarious, chaotic, irritating and possibly profound tragicomedy wash over you."", 'As rich and strange as we\'ve come to expect from the ""late"" Anderson films, but doesn\'t quite achieve the digressive whackadoo majesty of the novel.', ""A delirious triumph: a stylish-squared meeting of creative minds, a swirl of hypnosis and symbiosis, with Pynchon's prose partly assigned to a narrating character and partly diversified into funky dialogue exchanges."", ""How will this play in the non-Pynchon community? Not at all, sez us. But for the converted or the plain curious, it's something to see, if not cherish."", ""Anderson moves further from conventional storytelling with each new film, and closer to something more intuitive, more damning, more true. He hasn't made it there yet. God help us when he does."", ""Some storylines conclude, some collide, others dissipate. But the film's main crime is this: It's boring."", 'Joaquin Phoenix is perfectly cast as the perpetually befuddled Doc, a private detective of sorts who immerses himself in pot in the Los Angeles of 1970.', ""Although it's not as hermetic and impenetrable as The Master, Inherent Vice still comes off as a giant inside joke to anyone who hasn't read Pynchon's novel."", ""Inherent Vice is a sun-glared, neon-limned muddle of noir plotline and potheaded jokery that not only doesn't make sense, but actually seems to try hard not to."", ""Anderson's impeccable casting and music choices are captivating, and there is an amusing contrast between his attention to every detail and the convoluted storyline.""]",both
2014,The Guest (2014 American film),The Guest (2014 American film),one_day_since_yesterday_peter_bogdanovich_and_the_lost_american_film,[],both
